{
  "$schema": "../../../schemas/v043-fork-qualification-receipt.schema.json",
  "schema_version": "fiet-rindexer-v043-fork-qualification-receipt/v1",
  "sealed_at": "2026-08-25T11:10:15Z",
  "canonical_source": {
    "repository": "https://github.com/joshstevens19/rindexer",
    "tag": "v0.43.0",
    "commit": "4f441289b83855c357239d2729fb725a56c3060b",
    "tree": "80a2698f6be13949d84d920b01c02125af598d09"
  },
  "downstream_source": {
    "repository": "https://github.com/usherlabs/rindexer",
    "branch": "fiet/candidate-v0.43.0-1",
    "commit": "47f2b8513056b902f0553a906a5537069cfa76a2",
    "tree": "22210c1715c7cdd730caa3da1a59ce3e0e1ce9c0"
  },
  "toolchain": {
    "rustc": "rustc 1.97.0 (2d8144b78 2026-07-07)",
    "cargo_nextest": "cargo-nextest 0.9.143 (60fa45f63 2026-08-04)",
    "host": "x86_64-unknown-linux-gnu",
    "kernel": "Linux 6.17.0-1022-azure",
    "all_features_bindgen_extra_clang_args": "-isystem /usr/lib/gcc/x86_64-linux-gnu/13/include -isystem /usr/include -isystem /usr/include/x86_64-linux-gnu"
  },
  "qualification_runs": [
    {
      "kind": "governance_schema_and_ancestry",
      "command": "AJV draft-2020 schemas; Python governance regressions; pinned-baseline probes; validate_downstream_governance.py",
      "result": "pass",
      "notes": "Candidate ledger has one final disposition per inventory item, zero pending items, valid active ancestry, and no unledgered governed path.",
      "evidence_url": "https://github.com/usherlabs/rindexer/actions/runs/32838237048"
    },
    {
      "kind": "clippy_workspace_all_targets",
      "command": "cargo clippy --workspace --all-targets -- -D warnings",
      "result": "pass",
      "notes": "Passed locally and on the aggregate candidate PR.",
      "evidence_url": "https://github.com/usherlabs/rindexer/actions/runs/32838237327"
    },
    {
      "kind": "rindexer_package",
      "command": "cargo nextest run -p rindexer",
      "result": "pass",
      "tests": 887,
      "skipped": 4,
      "notes": "Covers filter shape, detail keys, Bloom progress, retry ranges, stream completion, native-transfer closure, reorg configuration and rewind, restart, redelivery, HyperSync-off, and exact-cursor migration regressions."
    },
    {
      "kind": "exact_cursor_postgres",
      "command": "cargo nextest run -p rindexer --test postgres_atomic_cursor",
      "result": "pass",
      "tests": 8,
      "skipped": 0,
      "notes": "Includes rollback when cursor persistence fails, no legacy fan-out, fail-closed missing seeds, concurrent legacy/exact seeding, and exact-member reorg rewind."
    },
    {
      "kind": "callback_failure_ordering",
      "command": "cargo nextest run -p rindexer callback_failure_does_not_poll_cursor_persistence cursor_failure_remains_terminal_after_callback_success",
      "result": "pass",
      "tests": 2,
      "skipped": 0,
      "notes": "Normative callback completion is ordered before durable cursor advancement."
    },
    {
      "kind": "embedded_lifecycle_process",
      "command": "python3 scripts/qualify_embedded_lifecycle.py --binary target/debug/examples/embedded_lifecycle_probe --anvil $(command -v anvil) --output qualification/v0.43/candidate-embedded-lifecycle-receipt.json",
      "result": "pass",
      "tests": 3,
      "skipped": 0,
      "notes": "SIGTERM and SIGINT drain successfully; forced timeout exits 42; the engine binds no health listener and owns no process signal handler."
    },
    {
      "kind": "unexpected_live_eof_process",
      "command": "cargo nextest run -p rindexer unexpected_live_stream_eof_reaches_a_nonzero_process_exit -- --exact",
      "result": "pass",
      "tests": 1,
      "skipped": 0,
      "notes": "Unexpected live-stream completion exits the child process with non-zero status 67."
    },
    {
      "kind": "workspace_default_features",
      "command": "cargo nextest run --exclude rindexer_rust_playground --workspace",
      "result": "pass",
      "tests": 910,
      "skipped": 4,
      "notes": "Full default-feature workspace qualification passed locally; the aggregate PR default-feature stage also passed."
    },
    {
      "kind": "workspace_all_features",
      "command": "BINDGEN_EXTRA_CLANG_ARGS='-isystem /usr/lib/gcc/x86_64-linux-gnu/13/include -isystem /usr/include -isystem /usr/include/x86_64-linux-gnu' cargo nextest run --exclude rindexer_rust_playground --workspace --all-features --no-tests=fail",
      "result": "pass",
      "tests": 922,
      "skipped": 4,
      "notes": "All-feature qualification passed locally; explicit GCC/system include roots compensated for the host image's missing Clang resource headers without changing the machine."
    },
    {
      "kind": "docker_e2e",
      "command": "cargo run --bin e2e-tests -- --rindexer-binary target/release/rindexer_cli",
      "result": "pass",
      "notes": "Fresh GitHub-hosted PostgreSQL, Foundry, GraphQL, release binary, and E2E test-binary campaign passed on the aggregate candidate.",
      "evidence_url": "https://github.com/usherlabs/rindexer/actions/runs/32838236983"
    }
  ],
  "artifacts": {
    "inventory": {
      "path": "qualification/v0.43/candidate-downstream-patch-inventory.json",
      "sha256": "dc6f2e8996f6f2ac4ac4b092584ac63de03e5f27cd033f80b50ebef2f02a4df8"
    },
    "ledger": {
      "path": "qualification/v0.43/candidate-downstream-patches.json",
      "sha256": "78e4e2cbdf80679728e40a9852aa125a15fbcabef40d9c9e21b4be5308c6fcd2"
    },
    "governed_paths": {
      "path": "qualification/v0.43/candidate-governed-paths.json",
      "sha256": "9025622570185fbe152fe11ee4d4021bd40bbb2435eedd75f20d810ddf42c7ef"
    },
    "embedded_lifecycle_receipt": {
      "path": "qualification/v0.43/candidate-embedded-lifecycle-receipt.json",
      "sha256": "0ec5950ad92afb2d2e1645b809d986a51824d29a83c3cd78b3b04eaa26fccd71"
    },
    "test_results": {
      "path": "qualification/v0.43/candidate-test-results.json",
      "sha256": "5a53434468fef7f281ea08193e6df292a6a7cef024464b18fca57346099e944e"
    }
  },
  "verdict": "qualified",
  "release_authorized": false
}
